<xs:schema xmlns:xs="http://www.w3.org/2001/XMLSchema">
  <xs:element name="CATALOG">
    <xs:complexType>
      <xs:sequence>
        <xs:element name="CD" maxOccurs="unbounded" minOccurs="0">
          <xs:complexType>
            <xs:sequence>
              <xs:element type="xs:string" name="TITLE"/>
              <xs:element type="xs:string" name="ARTIST"/>
              <xs:element type="xs:string" name="COUNTRY"/>
              <xs:element type="xs:string" name="COMPANY"/>
              <xs:element type="xs:float" name="PRICE"/>
              <xs:element type="xs:float" name="COST" minOccurs="0"/>
              <xs:element type="xs:short" name="YEAR"/>
            </xs:sequence>
          </xs:complexType>
        </xs:element>
      </xs:sequence>
    </xs:complexType>
  </xs:element>
</xs:schema>

